{
  "name": "omiga-curated",
  "interface": {
    "displayName": "Omiga Curated Plugins"
  },
  "plugins": [
    {
      "name": "transcriptomics",
      "source": {
        "source": "local",
        "path": "./plugins/transcriptomics"
      },
      "policy": {
        "installation": "AVAILABLE",
        "authentication": "ON_USE"
      },
      "category": "Analysis"
    },
    {
      "name": "operator-seqtk",
      "source": {
        "source": "local",
        "path": "./plugins/operator-seqtk"
      },
      "policy": {
        "installation": "AVAILABLE",
        "authentication": "ON_USE"
      },
      "category": "Operator"
    },
    {
      "name": "visualization-r",
      "source": {
        "source": "local",
        "path": "./plugins/visualization-r"
      },
      "policy": {
        "installation": "AVAILABLE",
        "authentication": "ON_USE"
      },
      "category": "Visualization"
    },
    {
      "name": "source-ncbi",
      "source": {
        "source": "local",
        "path": "./plugins/source-ncbi"
      },
      "policy": {
        "installation": "AVAILABLE",
        "authentication": "ON_USE"
      },
      "category": "Retrieval"
    },
    {
      "name": "source-embl-ebi",
      "source": {
        "source": "local",
        "path": "./plugins/source-embl-ebi"
      },
      "policy": {
        "installation": "AVAILABLE",
        "authentication": "ON_USE"
      },
      "category": "Retrieval"
    },
    {
      "name": "retrieval-dataset-gtex",
      "source": {
        "source": "local",
        "path": "./plugins/retrieval-dataset-gtex"
      },
      "policy": {
        "installation": "AVAILABLE",
        "authentication": "ON_USE"
      },
      "category": "Retrieval"
    },
    {
      "name": "retrieval-dataset-cbioportal",
      "source": {
        "source": "local",
        "path": "./plugins/retrieval-dataset-cbioportal"
      },
      "policy": {
        "installation": "AVAILABLE",
        "authentication": "ON_USE"
      },
      "category": "Retrieval"
    },
    {
      "name": "retrieval-literature-semantic-scholar",
      "source": {
        "source": "local",
        "path": "./plugins/retrieval-literature-semantic-scholar"
      },
      "policy": {
        "installation": "AVAILABLE",
        "authentication": "ON_USE"
      },
      "category": "Retrieval"
    },
    {
      "name": "retrieval-knowledge-uniprot",
      "source": {
        "source": "local",
        "path": "./plugins/retrieval-knowledge-uniprot"
      },
      "policy": {
        "installation": "AVAILABLE",
        "authentication": "ON_USE"
      },
      "category": "Retrieval"
    },
    {
      "name": "omiga-developer-tools",
      "source": {
        "source": "local",
        "path": "./plugins/omiga-developer-tools"
      },
      "policy": {
        "installation": "AVAILABLE",
        "authentication": "ON_USE"
      },
      "category": "Tools"
    },
    {
      "name": "ngs-alignment",
      "source": {
        "source": "local",
        "path": "./plugins/ngs-alignment"
      },
      "policy": {
        "installation": "AVAILABLE",
        "authentication": "ON_USE"
      },
      "category": "Bioinformatics"
    }
  ],
  "remote": {
    "provider": "github",
    "url": "https://raw.githubusercontent.com/<owner>/omiga-plugins/main/marketplace.json",
    "repositoryUrl": "https://github.com/<owner>/omiga-plugins",
    "changelogUrl": "https://github.com/<owner>/omiga-plugins/releases"
  }
}
